{
  "catalog": "airbyte",
  "schema_version": 1,
  "generated_at": "2026-01-06T14:51:20.029490Z",
  "meta": {
    "fetched_at": "2026-01-06T14:51:20.029468Z",
    "source_url": "file:///private/var/folders/rk/vtq2689j32l8s72hlknmwqhw0000gn/T/pytest-of-sergeyenin/pytest-144/test_connectors_sync_with_vali0/test_catalog.json",
    "sha256": "785496e155157a1898bcccfe7be6882e854fbef69e8f34f18be3fa6fd4522d7b",
    "etag": null,
    "last_modified": null
  },
  "connectors": []
}